{
  "app": "erp-aks",
  "version": 2,
  "generatedNote": "AIRA Tool Router config — FULL coverage (Simple ERP / AKS). DRAFT untuk review Ndoro, BELUM live. Selaras BRD AIRA §8.9: name/group/module/desc/risk/roles/input/output/handler/confirm_template. Handler = path internal NYATA (diaudit dari server/src/routes/*.ts + mount di index.ts). risk: read=GET/query/report, write=create/update non-finansial, critical=submit/cancel/approve/posting GL/payment/delete data finansial. roles diturunkan dari DEFAULT_MATRIX (constants/modules.ts); Admin super-admin selalu lolos. enabled=false default kecuali 16 tool warisan v1 yg pertahankan flag-nya. confirm_template WAJIB untuk write/critical (HITL). Endpoint EXCLUDE (health/telegram/public/auth/attachment file-IO/import multipart/backup binary/dummy data/ai self-config) TIDAK didaftarkan — lihat docs/ai-tool-coverage-analysis.md.",
  "modules": [
    "sales_order",
    "delivery_order",
    "sales_invoice",
    "quotation",
    "sales_return",
    "customer_deposit",
    "purchase_order",
    "goods_receipt",
    "purchase_invoice",
    "vendor_deposit",
    "inventory",
    "stock_transfer",
    "stock_opname",
    "production",
    "warehouse",
    "payment",
    "reconciliation",
    "recurring",
    "project_guarantee",
    "coa",
    "journal",
    "fixed_assets",
    "approvals",
    "ga_assets",
    "ga_vehicle",
    "ga_building",
    "ga_equipment",
    "ga_maintenance",
    "ga_inventory",
    "ga_documents",
    "ga_master",
    "reports",
    "parties",
    "settings",
    "users",
    "audit"
  ],
  "roles": [
    "Admin",
    "Accountant",
    "StaffProduksi",
    "Viewer"
  ],
  "capabilities": [
    "doc.cancel",
    "approval.decide",
    "approval.bypass",
    "approval.view_all",
    "inventory.negative_stock",
    "rbac.manage"
  ],
  "tools": [
    {
      "name": "quot_list",
      "group": "Penjualan",
      "module": "quotation",
      "desc": "Daftar penawaran (filter status/party/tanggal).",
      "risk": "read",
      "roles": [
        "Admin",
        "Accountant",
        "Viewer"
      ],
      "input": {
        "status": "string",
        "partyId": "string",
        "page": "number"
      },
      "output": {
        "items": "array"
      },
      "handler": "GET /api/quotations",
      "permAction": "view",
      "enabled": false,
      "level": 1,
      "phase": 1
    },
    {
      "name": "quot_stats",
      "group": "Penjualan",
      "module": "quotation",
      "desc": "Statistik penawaran (jumlah per status, nilai).",
      "risk": "read",
      "roles": [
        "Admin",
        "Accountant",
        "Viewer"
      ],
      "input": {},
      "output": {
        "stats": "object"
      },
      "handler": "GET /api/quotations/stats",
      "permAction": "view",
      "enabled": false,
      "level": 1,
      "phase": 1
    },
    {
      "name": "quot_get",
      "group": "Penjualan",
      "module": "quotation",
      "desc": "Detail satu penawaran.",
      "risk": "read",
      "roles": [
        "Admin",
        "Accountant",
        "Viewer"
      ],
      "input": {
        "id": "string"
      },
      "output": {
        "quotation": "object"
      },
      "handler": "GET /api/quotations/:id",
      "permAction": "view",
      "enabled": false,
      "level": 1,
      "phase": 1
    },
    {
      "name": "quot_create",
      "group": "Penjualan",
      "module": "quotation",
      "desc": "Buat penawaran (non-binding, tanpa GL).",
      "risk": "write",
      "roles": [
        "Admin",
        "Accountant"
      ],
      "input": {
        "date": "date",
        "validUntil": "date",
        "partyId": "string",
        "items": "array"
      },
      "output": {
        "id": "string",
        "number": "string"
      },
      "handler": "POST /api/quotations",
      "permAction": "edit",
      "enabled": false,
      "level": 1,
      "phase": 1,
      "confirm_template": "Buat Penawaran untuk {partyId}, {items} item, berlaku s/d {validUntil}. Setujui?"
    },
    {
      "name": "quot_update",
      "group": "Penjualan",
      "module": "quotation",
      "desc": "Ubah penawaran (selama belum dikonversi).",
      "risk": "write",
      "roles": [
        "Admin",
        "Accountant"
      ],
      "input": {
        "id": "string",
        "items": "array"
      },
      "output": {
        "id": "string"
      },
      "handler": "PUT /api/quotations/:id",
      "permAction": "edit",
      "enabled": false,
      "level": 1,
      "phase": 1,
      "confirm_template": "Ubah Penawaran {id}. Setujui?"
    },
    {
      "name": "quot_delete",
      "group": "Penjualan",
      "module": "quotation",
      "desc": "Hapus penawaran (draft).",
      "risk": "critical",
      "roles": [
        "Admin",
        "Accountant"
      ],
      "input": {
        "id": "string"
      },
      "output": {
        "status": "string"
      },
      "handler": "DELETE /api/quotations/:id",
      "permAction": "edit",
      "enabled": false,
      "level": 1,
      "phase": 1,
      "confirm_template": "HAPUS Penawaran {id}? Aksi permanen."
    },
    {
      "name": "quot_send",
      "group": "Penjualan",
      "module": "quotation",
      "desc": "Tandai penawaran terkirim ke pelanggan.",
      "risk": "write",
      "roles": [
        "Admin",
        "Accountant"
      ],
      "input": {
        "id": "string"
      },
      "output": {
        "status": "string"
      },
      "handler": "PATCH /api/quotations/:id/send",
      "permAction": "edit",
      "enabled": false,
      "level": 1,
      "phase": 1,
      "confirm_template": "Tandai Penawaran {id} sebagai TERKIRIM. Setujui?"
    },
    {
      "name": "quot_accept",
      "group": "Penjualan",
      "module": "quotation",
      "desc": "Tandai penawaran diterima pelanggan.",
      "risk": "write",
      "roles": [
        "Admin",
        "Accountant"
      ],
      "input": {
        "id": "string"
      },
      "output": {
        "status": "string"
      },
      "handler": "PATCH /api/quotations/:id/accept",
      "permAction": "edit",
      "enabled": false,
      "level": 1,
      "phase": 1,
      "confirm_template": "Tandai Penawaran {id} DITERIMA pelanggan. Setujui?"
    },
    {
      "name": "quot_reject",
      "group": "Penjualan",
      "module": "quotation",
      "desc": "Tandai penawaran ditolak pelanggan.",
      "risk": "write",
      "roles": [
        "Admin",
        "Accountant"
      ],
      "input": {
        "id": "string"
      },
      "output": {
        "status": "string"
      },
      "handler": "PATCH /api/quotations/:id/reject",
      "permAction": "edit",
      "enabled": false,
      "level": 1,
      "phase": 1,
      "confirm_template": "Tandai Penawaran {id} DITOLAK pelanggan. Setujui?"
    },
    {
      "name": "quot_cancel",
      "group": "Penjualan",
      "module": "quotation",
      "desc": "Batalkan penawaran.",
      "risk": "critical",
      "roles": [
        "Admin",
        "Accountant"
      ],
      "input": {
        "id": "string"
      },
      "output": {
        "status": "string"
      },
      "handler": "PATCH /api/quotations/:id/cancel",
      "permAction": "edit",
      "enabled": false,
      "level": 1,
      "phase": 1,
      "requiresCapability": "doc.cancel",
      "confirm_template": "BATALKAN Penawaran {id}? Aksi ini perlu hak doc.cancel."
    },
    {
      "name": "quot_convert_payload",
      "group": "Penjualan",
      "module": "quotation",
      "desc": "Ambil payload untuk konversi penawaran → SO/invoice.",
      "risk": "read",
      "roles": [
        "Admin",
        "Accountant",
        "Viewer"
      ],
      "input": {
        "id": "string"
      },
      "output": {
        "payload": "object"
      },
      "handler": "GET /api/quotations/:id/convert-payload",
      "permAction": "view",
      "enabled": false,
      "level": 1,
      "phase": 1
    },
    {
      "name": "quot_link",
      "group": "Penjualan",
      "module": "quotation",
      "desc": "Tautkan penawaran ke dokumen turunan (SO/invoice).",
      "risk": "write",
      "roles": [
        "Admin",
        "Accountant"
      ],
      "input": {
        "id": "string",
        "targetId": "string"
      },
      "output": {
        "status": "string"
      },
      "handler": "POST /api/quotations/:id/link",
      "permAction": "edit",
      "enabled": false,
      "level": 1,
      "phase": 1,
      "confirm_template": "Tautkan Penawaran {id} ke dokumen {targetId}. Setujui?"
    },
    {
      "name": "inq_list",
      "group": "Penjualan",
      "module": "quotation",
      "desc": "Daftar inquiry/permintaan masuk dari pelanggan.",
      "risk": "read",
      "roles": [
        "Admin",
        "Accountant",
        "Viewer"
      ],
      "input": {
        "status": "string"
      },
      "output": {
        "items": "array"
      },
      "handler": "GET /api/inquiries",
      "permAction": "view",
      "enabled": false,
      "level": 1,
      "phase": 1
    },
    {
      "name": "inq_stats",
      "group": "Penjualan",
      "module": "quotation",
      "desc": "Statistik inquiry per status.",
      "risk": "read",
      "roles": [
        "Admin",
        "Accountant",
        "Viewer"
      ],
      "input": {},
      "output": {
        "stats": "object"
      },
      "handler": "GET /api/inquiries/stats",
      "permAction": "view",
      "enabled": false,
      "level": 1,
      "phase": 1
    },
    {
      "name": "inq_get",
      "group": "Penjualan",
      "module": "quotation",
      "desc": "Detail satu inquiry.",
      "risk": "read",
      "roles": [
        "Admin",
        "Accountant",
        "Viewer"
      ],
      "input": {
        "id": "string"
      },
      "output": {
        "inquiry": "object"
      },
      "handler": "GET /api/inquiries/:id",
      "permAction": "view",
      "enabled": false,
      "level": 1,
      "phase": 1
    },
    {
      "name": "inq_create",